[
 {
  "id": "Q-AGP-0001",
  "t": "P1-M3-3",
  "materia": "Noções de Direito Administrativo e Administração Pública",
  "bloco": "P1",
  "item_edital": "4.3",
  "a": [
   "A-AGP-0001"
  ],
  "ponto": "S01",
  "g": "C",
  "e": "O prazo de validade do concurso público será de até dois anos, prorrogável uma vez, por igual período.",
  "formato": "assertiva",
  "c": "CF, art. 37, III.",
  "padrao": "troca_numero",
  "tipo_erro": "",
  "par": "Q-AGP-0002",
  "dif": 2,
  "r": 1,
  "incidencia": "alta",
  "fonte": {
   "tipo": "lei",
   "ref": "CF arts. 37, 38 e 41",
   "versao": "vigente",
   "conferida": "conhecimento"
  },
  "vigencia": "estavel",
  "risco": [],
  "origem": "autoral",
  "lote": "L12",
  "criada": "2026-10-16",
  "versao": 1,
  "tags": [],
  "val": {
   "mecanica": true,
   "cega": "ok",
   "humana": false
  }
 },
 {
  "id": "Q-AGP-0002",
  "t": "P1-M3-3",
  "materia": "Noções de Direito Administrativo e Administração Pública",
  "bloco": "P1",
  "item_edital": "4.3",
  "a": [
   "A-AGP-0001"
  ],
  "ponto": "S01",
  "g": "E",
  "e": "O prazo de validade do concurso público será de até dois anos, prorrogável por tantas vezes quantas forem necessárias, por igual período.",
  "formato": "assertiva",
  "c": "CF, art. 37, III.",
  "padrao": "troca_numero",
  "tipo_erro": "admite prorrogações ilimitadas",
  "par": "Q-AGP-0001",
  "dif": 2,
  "r": 1,
  "incidencia": "alta",
  "fonte": {
   "tipo": "lei",
   "ref": "CF arts. 37, 38 e 41",
   "versao": "vigente",
   "conferida": "conhecimento"
  },
  "vigencia": "estavel",
  "risco": [],
  "origem": "autoral",
  "lote": "L12",
  "criada": "2026-10-16",
  "versao": 1,
  "tags": [],
  "val": {
   "mecanica": true,
   "cega": "ok",
   "humana": false
  }
 },
 {
  "id": "Q-AGP-0003",
  "t": "P1-M3-3",
  "materia": "Noções de Direito Administrativo e Administração Pública",
  "bloco": "P1",
  "item_edital": "4.3",
  "a": [
   "A-AGP-0001"
  ],
  "ponto": "S01",
  "g": "C",
  "e": "Durante o prazo improrrogável previsto no edital de convocação, o aprovado em concurso público será convocado com prioridade sobre novos concursados para assumir cargo ou emprego, na carreira.",
  "formato": "assertiva",
  "c": "CF, art. 37, IV.",
  "padrao": "troca_efeito",
  "tipo_erro": "",
  "par": "Q-AGP-0004",
  "dif": 3,
  "r": 1,
  "incidencia": "alta",
  "fonte": {
   "tipo": "lei",
   "ref": "CF arts. 37, 38 e 41",
   "versao": "vigente",
   "conferida": "conhecimento"
  },
  "vigencia": "estavel",
  "risco": [],
  "origem": "autoral",
  "lote": "L12",
  "criada": "2026-10-16",
  "versao": 1,
  "tags": [],
  "val": {
   "mecanica": true,
   "cega": "ok",
   "humana": false
  }
 },
 {
  "id": "Q-AGP-0004",
  "t": "P1-M3-3",
  "materia": "Noções de Direito Administrativo e Administração Pública",
  "bloco": "P1",
  "item_edital": "4.3",
  "a": [
   "A-AGP-0001"
  ],
  "ponto": "S01",
  "g": "E",
  "e": "Durante o prazo improrrogável previsto no edital de convocação, o aprovado em concurso público será convocado com a mesma prioridade dos novos concursados para assumir cargo ou emprego, na carreira.",
  "formato": "assertiva",
  "c": "CF, art. 37, IV.",
  "padrao": "troca_efeito",
  "tipo_erro": "equipara aprovados e novos concursados",
  "par": "Q-AGP-0003",
  "dif": 3,
  "r": 1,
  "incidencia": "alta",
  "fonte": {
   "tipo": "lei",
   "ref": "CF arts. 37, 38 e 41",
   "versao": "vigente",
   "conferida": "conhecimento"
  },
  "vigencia": "estavel",
  "risco": [],
  "origem": "autoral",
  "lote": "L12",
  "criada": "2026-10-16",
  "versao": 1,
  "tags": [],
  "val": {
   "mecanica": true,
   "cega": "ok",
   "humana": false
  }
 },
 {
  "id": "Q-AGP-0005",
  "t": "P1-M3-3",
  "materia": "Noções de Direito Administrativo e Administração Pública",
  "bloco": "P1",
  "item_edital": "4.3",
  "a": [
   "A-AGP-0001"
  ],
  "ponto": "S01",
  "g": "C",
  "e": "A investidura em cargo ou emprego público depende de aprovação prévia em concurso público, ressalvadas as nomeações para cargo em comissão declarado em lei de livre nomeação e exoneração.",
  "formato": "assertiva",
  "c": "CF, art. 37, II.",
  "padrao": "excecao_omitida",
  "tipo_erro": "",
  "par": "Q-AGP-0006",
  "dif": 3,
  "r": 1,
  "incidencia": "alta",
  "fonte": {
   "tipo": "lei",
   "ref": "CF arts. 37, 38 e 41",
   "versao": "vigente",
   "conferida": "conhecimento"
  },
  "vigencia": "estavel",
  "risco": [],
  "origem": "autoral",
  "lote": "L12",
  "criada": "2026-10-16",
  "versao": 1,
  "tags": [],
  "val": {
   "mecanica": true,
   "cega": "ok",
   "humana": false
  }
 },
 {
  "id": "Q-AGP-0006",
  "t": "P1-M3-3",
  "materia": "Noções de Direito Administrativo e Administração Pública",
  "bloco": "P1",
  "item_edital": "4.3",
  "a": [
   "A-AGP-0001"
  ],
  "ponto": "S01",
  "g": "E",
  "e": "A investidura em cargo ou emprego público depende de aprovação prévia em concurso público, sem nenhuma ressalva, inclusive para os cargos em comissão e as funções de confiança.",
  "formato": "assertiva",
  "c": "CF, art. 37, II.",
  "padrao": "excecao_omitida",
  "tipo_erro": "omite ressalva dos cargos em comissão",
  "par": "Q-AGP-0005",
  "dif": 3,
  "r": 1,
  "incidencia": "alta",
  "fonte": {
   "tipo": "lei",
   "ref": "CF arts. 37, 38 e 41",
   "versao": "vigente",
   "conferida": "conhecimento"
  },
  "vigencia": "estavel",
  "risco": [],
  "origem": "autoral",
  "lote": "L12",
  "criada": "2026-10-16",
  "versao": 1,
  "tags": [],
  "val": {
   "mecanica": true,
   "cega": "ok",
   "humana": false
  }
 },
 {
  "id": "Q-AGP-0007",
  "t": "P1-M3-3",
  "materia": "Noções de Direito Administrativo e Administração Pública",
  "bloco": "P1",
  "item_edital": "4.3",
  "a": [
   "A-AGP-0001"
  ],
  "ponto": "S01",
  "g": "C",
  "e": "Os cargos, empregos e funções públicas são acessíveis aos brasileiros que preencham os requisitos estabelecidos em lei, assim como aos estrangeiros, na forma da lei.",
  "formato": "assertiva",
  "c": "CF, art. 37, I.",
  "padrao": "excecao_omitida",
  "tipo_erro": "",
  "par": "Q-AGP-0008",
  "dif": 3,
  "r": 1,
  "incidencia": "alta",
  "fonte": {
   "tipo": "lei",
   "ref": "CF arts. 37, 38 e 41",
   "versao": "vigente",
   "conferida": "conhecimento"
  },
  "vigencia": "estavel",
  "risco": [],
  "origem": "autoral",
  "lote": "L12",
  "criada": "2026-10-16",
  "versao": 1,
  "tags": [],
  "val": {
   "mecanica": true,
   "cega": "ok",
   "humana": false
  }
 },
 {
  "id": "Q-AGP-0008",
  "t": "P1-M3-3",
  "materia": "Noções de Direito Administrativo e Administração Pública",
  "bloco": "P1",
  "item_edital": "4.3",
  "a": [
   "A-AGP-0001"
  ],
  "ponto": "S01",
  "g": "E",
  "e": "Os cargos, empregos e funções públicas são acessíveis exclusivamente aos brasileiros natos, vedado o acesso de estrangeiros em qualquer hipótese.",
  "formato": "assertiva",
  "c": "CF, art. 37, I.",
  "padrao": "excecao_omitida",
  "tipo_erro": "exclui estrangeiros",
  "par": "Q-AGP-0007",
  "dif": 3,
  "r": 1,
  "incidencia": "alta",
  "fonte": {
   "tipo": "lei",
   "ref": "CF arts. 37, 38 e 41",
   "versao": "vigente",
   "conferida": "conhecimento"
  },
  "vigencia": "estavel",
  "risco": [],
  "origem": "autoral",
  "lote": "L12",
  "criada": "2026-10-16",
  "versao": 1,
  "tags": [],
  "val": {
   "mecanica": true,
   "cega": "ok",
   "humana": false
  }
 },
 {
  "id": "Q-AGP-0009",
  "t": "P1-M3-3",
  "materia": "Noções de Direito Administrativo e Administração Pública",
  "bloco": "P1",
  "item_edital": "4.3",
  "a": [
   "A-AGP-0002"
  ],
  "ponto": "S01",
  "g": "C",
  "e": "Segundo o STF, o candidato aprovado dentro do número de vagas previsto no edital tem direito subjetivo à nomeação durante o prazo de validade do concurso, ressalvadas situações excepcionais, devidamente motivadas, de superveniência, imprevisibilidade e gravidade.",
  "formato": "assertiva",
  "c": "STF, RE 598.099 (Tema 161).",
  "padrao": "excecao_omitida",
  "tipo_erro": "",
  "par": "Q-AGP-0010",
  "dif": 5,
  "r": 1,
  "incidencia": "alta",
  "fonte": {
   "tipo": "jurisprudencia",
   "ref": "Teses de repercussão geral do STF (tesesesumulas.com.br, 2026-10-16)",
   "versao": "conhecimento verificado em fonte secundária",
   "conferida": "conhecimento"
  },
  "vigencia": "estavel",
  "risco": [
   "jurisprudencia_conhecimento"
  ],
  "origem": "autoral",
  "lote": "L12",
  "criada": "2026-10-16",
  "versao": 1,
  "tags": [],
  "val": {
   "mecanica": true,
   "cega": "ok",
   "humana": false
  }
 },
 {
  "id": "Q-AGP-0010",
  "t": "P1-M3-3",
  "materia": "Noções de Direito Administrativo e Administração Pública",
  "bloco": "P1",
  "item_edital": "4.3",
  "a": [
   "A-AGP-0002"
  ],
  "ponto": "S01",
  "g": "E",
  "e": "Segundo o STF, o candidato aprovado dentro do número de vagas previsto no edital tem mera expectativa de direito à nomeação, cabendo à Administração decidir livremente sobre a convocação, sem necessidade de motivação.",
  "formato": "assertiva",
  "c": "STF, RE 598.099 (Tema 161).",
  "padrao": "excecao_omitida",
  "tipo_erro": "reduz a expectativa de direito",
  "par": "Q-AGP-0009",
  "dif": 5,
  "r": 1,
  "incidencia": "alta",
  "fonte": {
   "tipo": "jurisprudencia",
   "ref": "Teses de repercussão geral do STF (tesesesumulas.com.br, 2026-10-16)",
   "versao": "conhecimento verificado em fonte secundária",
   "conferida": "conhecimento"
  },
  "vigencia": "estavel",
  "risco": [
   "jurisprudencia_conhecimento"
  ],
  "origem": "autoral",
  "lote": "L12",
  "criada": "2026-10-16",
  "versao": 1,
  "tags": [],
  "val": {
   "mecanica": true,
   "cega": "ok",
   "humana": false
  }
 },
 {
  "id": "Q-AGP-0011",
  "t": "P1-M3-3",
  "materia": "Noções de Direito Administrativo e Administração Pública",
  "bloco": "P1",
  "item_edital": "4.3",
  "a": [
   "A-AGP-0002"
  ],
  "ponto": "S01",
  "g": "C",
  "e": "Segundo a Súmula Vinculante 44, só por lei se pode sujeitar a exame psicotécnico a habilitação de candidato a cargo público.",
  "formato": "assertiva",
  "c": "SV 44.",
  "padrao": "troca_autoridade",